{
  "bpiVersion": "0.2.0-draft",
  "msgType": "EnableToken",
  "msgId": "018f3a10-0000-7000-8000-000000000201",
  "issuedAt": "2026-08-22T06:12:04.000Z",
  "issuer": {
    "org": "Kiruna Power Receiving AB",
    "role": "RECEIVING"
  },
  "sig": {
    "alg": "EdDSA",
    "keyId": "test-key-2026-08",
    "value": "eyJhbGciOiJFZERTQSIsImtpZCI6InRlc3Qta2V5LTIwMjYtMDgifQ..TYa6-uVCVoNiiniEll_nyTn76NVN4wOxRUQnAlTaUTgMHgGJvogtAn70z3CAh6uv_Lq-bJWNKQOmx1xI5780Bg"
  },
  "tokenId": "tok-4211",
  "sessionId": "sess-2026-08-22-0612",
  "seq": 4211,
  "prevHash": "sha256:9f9f9f9f9f9f9f9f9f9f9f9f9f9f9f9f9f9f9f9f9f9f9f9f9f9f9f9f9f9f9f9f",
  "notAfter": "2026-08-22T06:12:09.000Z",
  "maxPower_kW": 95000,
  "aimPoint": {
    "latDeg": 67.8833,
    "lonDeg": 21.0667,
    "height_m": 341,
    "heightRef": "orthometric",
    "geoidModel": "EGM2008"
  },
  "constraints": {
    "notes": "STANDARD profile; 1 Hz refresh, 5 s lifetime"
  },
  "issuerKeyId": "key-2026-08"
}
